{
  "$schema": "https://json-schema.org/draft/2020-12/schema",
  "$id": "https://omoba.io/schemas/omoba.character-contract.v1.json",
  "title": "omoba.character-contract.v1",
  "type": "object",
  "additionalProperties": false,
  "required": ["schema", "schemaVersion", "projectId", "revision", "previousRevision", "license", "source",
               "package", "rig", "timing", "rules", "slots", "heroes"],
  "properties": {
    "schema": { "const": "omoba.character-contract.v1" },
    "schemaVersion": { "const": 1 },
    "projectId": { "const": "omoba" },
    "revision": { "$ref": "#/$defs/revision" },
    "previousRevision": { "oneOf": [{ "$ref": "#/$defs/revision" }, { "type": "null" }] },
    "license": { "type": "string", "minLength": 1, "maxLength": 64 },
    "source": {
      "type": "object",
      "additionalProperties": false,
      "required": ["commit", "exporter", "inputsSha256", "gameplayRevision", "presentationSha256", "motionLibrary",
                   "protocolVersion"],
      "properties": {
        "commit": { "type": "string", "pattern": "^[0-9a-f]{7,40}$" },
        "exporter": { "type": "string", "maxLength": 200 },
        "inputsSha256": { "$ref": "#/$defs/sha256" },
        "gameplayRevision": { "type": "string", "maxLength": 64 },
        "presentationSha256": { "$ref": "#/$defs/sha256" },
        "motionLibrary": {
          "type": "object",
          "additionalProperties": false,
          "required": ["schemaVersion", "sha256", "clips"],
          "properties": {
            "schemaVersion": { "type": "integer", "minimum": 1 },
            "sha256": { "$ref": "#/$defs/sha256" },
            "clips": { "type": "integer", "minimum": 1, "maximum": 256 }
          }
        },
        "protocolVersion": { "type": "integer", "minimum": 1 }
      }
    },
    "package": {
      "type": "object",
      "additionalProperties": false,
      "required": ["extrasKey", "sourceFormats", "rendition", "slotNaming", "customPlayback"],
      "properties": {
        "extrasKey": { "const": "ekza_animation_set_v1" },
        "sourceFormats": { "type": "array", "minItems": 1, "uniqueItems": true,
                           "items": { "enum": ["vrm1", "vrm0"] } },
        "rendition": {
          "type": "object",
          "additionalProperties": false,
          "required": ["platform", "profile", "version"],
          "properties": {
            "platform": { "type": "string", "pattern": "^[a-z][a-z0-9-]{1,62}$" },
            "profile": { "type": "string", "pattern": "^[a-z][a-z0-9-]{1,62}$" },
            "version": { "type": "integer", "minimum": 1 }
          }
        },
        "slotNaming": { "const": "animation-name-equals-slot-id" },
        "customPlayback": {
          "type": "object",
          "additionalProperties": false,
          "required": ["rate", "start"],
          "properties": { "rate": { "const": 1 }, "start": { "const": 0 } }
        }
      }
    },
    "rig": {
      "type": "object",
      "additionalProperties": false,
      "required": ["kind", "restPose", "facing", "requiredBones", "requiredBonesVrm0", "drivenBones", "maxHumanoidBones",
                   "maxNodes", "uniformScale", "fingers", "thumbsRecommended", "legLengthFrom", "referenceLegLengthM"],
      "properties": {
        "kind": { "const": "vrm-humanoid" },
        "restPose": { "const": "t-pose" },
        "facing": { "const": "as-vrm-spec" },
        "requiredBones": { "$ref": "#/$defs/boneList" },
        "requiredBonesVrm0": { "$ref": "#/$defs/boneList" },
        "drivenBones": { "$ref": "#/$defs/boneList" },
        "maxHumanoidBones": { "type": "integer", "minimum": 15, "maximum": 64 },
        "maxNodes": { "type": "integer", "minimum": 1, "maximum": 4096 },
        "uniformScale": { "enum": ["humanoid-bones-and-ancestors", "none"] },
        "fingers": { "enum": ["optional", "required"] },
        "thumbsRecommended": { "type": "boolean" },
        "legLengthFrom": { "const": "hips-to-feet" },
        "referenceLegLengthM": { "type": "number", "exclusiveMinimum": 0 }
      }
    },
    "timing": {
      "type": "object",
      "additionalProperties": false,
      "required": ["blendSecs", "idleGraceSecs", "facingHoldSecs", "contactLimitSecs", "rowRate", "rowStart", "fitRate",
                   "unseenHoldSecs", "freshSecs", "maxGapSecs", "deathCut", "movementInterruptsAction",
                   "newActionRestarts"],
      "properties": {
        "blendSecs": { "$ref": "#/$defs/secs" },
        "idleGraceSecs": { "$ref": "#/$defs/secs" },
        "facingHoldSecs": {
          "type": "object", "additionalProperties": false, "required": ["basic", "skill"],
          "properties": { "basic": { "$ref": "#/$defs/secs" }, "skill": { "$ref": "#/$defs/secs" } }
        },
        "contactLimitSecs": { "$ref": "#/$defs/secs" },
        "rowRate": { "$ref": "#/$defs/range" },
        "rowStart": { "$ref": "#/$defs/range" },
        "fitRate": { "$ref": "#/$defs/range" },
        "unseenHoldSecs": { "$ref": "#/$defs/secs" },
        "freshSecs": { "$ref": "#/$defs/secs" },
        "maxGapSecs": { "$ref": "#/$defs/secs" },
        "deathCut": { "enum": ["immediate"] },
        "movementInterruptsAction": { "type": "boolean" },
        "newActionRestarts": { "type": "boolean" }
      }
    },
    "rules": {
      "type": "array",
      "minItems": 1,
      "items": {
        "type": "object",
        "additionalProperties": false,
        "required": ["id", "severity", "scope", "params"],
        "properties": {
          "id": { "type": "string", "pattern": "^(pack|clip)\\.[a-z][a-z0-9-]{1,40}$" },
          "severity": { "enum": ["error", "warning"] },
          "scope": { "enum": ["pack", "clip"] },
          "params": { "type": "object" }
        }
      }
    },
    "slots": {
      "type": "object",
      "minProperties": 3,
      "propertyNames": { "$ref": "#/$defs/slotId" },
      "additionalProperties": { "$ref": "#/$defs/slot" }
    },
    "heroes": {
      "type": "array",
      "minItems": 1,
      "items": { "$ref": "#/$defs/hero" }
    }
  },
  "$defs": {
    "sha256": { "type": "string", "pattern": "^[0-9a-f]{64}$" },
    "revision": { "type": "string", "pattern": "^sha256-[0-9a-f]{64}$" },
    "secs": { "type": "number", "minimum": 0, "maximum": 60 },
    "range": { "type": "array", "prefixItems": [{ "type": "number" }, { "type": "number" }], "minItems": 2, "maxItems": 2 },
    "id": { "type": "string", "pattern": "^[a-z][a-z0-9_]{0,47}$" },
    "slotId": {
      "type": "string",
      "maxLength": 64,
      "pattern": "^(base\\.(idle|run|walk|death)|basic\\.[a-z][a-z0-9_]{0,31}\\.([0-9]|[a-z][a-z0-9_]{0,15}\\.[0-9])|skill\\.[a-z][a-z0-9_]{0,47}\\.(release|recast|windup))$"
    },
    "boneList": { "type": "array", "uniqueItems": true, "maxItems": 64,
                  "items": { "type": "string", "pattern": "^[a-z][A-Za-z]{1,31}$" } },
    "default": {
      "type": "object",
      "additionalProperties": false,
      "required": ["motion", "durationSecs", "looping", "contactSecs", "rate", "start", "playSecs",
                   "effectiveContactSecs", "standInFor"],
      "properties": {
        "motion": { "$ref": "#/$defs/id" },
        "durationSecs": { "type": "number", "exclusiveMinimum": 0, "maximum": 10 },
        "looping": { "type": "boolean" },
        "contactSecs": { "type": ["number", "null"], "minimum": 0 },
        "rate": { "type": "number", "minimum": 0.5, "maximum": 2 },
        "start": { "type": "number", "minimum": 0, "maximum": 0.8 },
        "playSecs": { "type": "number", "exclusiveMinimum": 0 },
        "effectiveContactSecs": { "type": ["number", "null"] },
        "standInFor": { "type": ["string", "null"], "maxLength": 64 }
      }
    },
    "slot": {
      "type": "object",
      "additionalProperties": false,
      "required": ["group", "role", "label", "kind", "phase", "edgeReleased", "customizable", "customizableFrom",
                   "reserved", "required", "default", "window", "inPlace", "loop", "contact", "telegraph", "handheld",
                   "sharesDefaultWith", "alternatesWith", "usedBy"],
      "properties": {
        "group": { "enum": ["base", "basic", "skill"] },
        "role": { "enum": ["idle", "run", "walk", "death", "basic", "release", "recast", "windup"] },
        "label": { "type": "string", "minLength": 1, "maxLength": 80 },
        "kind": { "enum": ["loop", "action", "hold"] },
        "phase": { "enum": ["locomotion", "state", "instant", "warn_fire", "fuse", "parry"] },
        "edgeReleased": { "type": "boolean" },
        "customizable": { "type": "boolean" },
        "customizableFrom": { "type": ["string", "null"], "pattern": "^[0-9]+(\\.[0-9]+)?$" },
        "reserved": { "type": "boolean" },
        "required": { "type": "boolean" },
        "default": { "$ref": "#/$defs/default" },
        "window": {
          "type": "object", "additionalProperties": false, "required": ["minSecs", "targetSecs", "maxSecs"],
          "properties": {
            "minSecs": { "type": "number", "exclusiveMinimum": 0 },
            "targetSecs": { "type": "number", "exclusiveMinimum": 0 },
            "maxSecs": { "type": "number", "exclusiveMinimum": 0, "maximum": 10 }
          }
        },
        "inPlace": { "type": "boolean" },
        "loop": { "type": "boolean" },
        "contact": {
          "oneOf": [
            { "type": "null" },
            {
              "type": "object", "additionalProperties": false, "required": ["required", "maxSecs", "targetSecs"],
              "properties": {
                "required": { "type": "boolean" },
                "maxSecs": { "type": ["number", "null"], "minimum": 0 },
                "targetSecs": { "type": ["number", "null"], "minimum": 0 }
              }
            }
          ]
        },
        "telegraph": {
          "oneOf": [
            { "type": "null" },
            {
              "type": "object", "additionalProperties": false, "required": ["secs", "serverWindupSecs", "fitWindup"],
              "properties": {
                "secs": { "type": "number", "exclusiveMinimum": 0 },
                "serverWindupSecs": { "type": ["number", "null"], "minimum": 0 },
                "fitWindup": { "type": "boolean" }
              }
            }
          ]
        },
        "handheld": {
          "oneOf": [
            { "type": "null" },
            {
              "type": "object", "additionalProperties": false, "required": ["item", "byMode", "bone", "muzzleWindowSecs"],
              "properties": {
                "item": { "type": "string", "pattern": "^[a-z][a-z0-9-]{0,63}$" },
                "byMode": { "type": "object", "additionalProperties": { "type": "string" } },
                "bone": { "type": "string" },
                "muzzleWindowSecs": { "oneOf": [{ "type": "null" }, { "$ref": "#/$defs/range" }] }
              }
            }
          ]
        },
        "sharesDefaultWith": { "type": "array", "uniqueItems": true, "items": { "$ref": "#/$defs/slotId" } },
        "alternatesWith": { "type": "array", "uniqueItems": true, "maxItems": 1, "items": { "$ref": "#/$defs/slotId" } },
        "usedBy": { "type": "array", "minItems": 1, "uniqueItems": true,
                    "items": { "type": "string", "pattern": "^(\\*|[a-z][a-z0-9_]{0,31})$" } },
        "skill": { "$ref": "#/$defs/id" },
        "class": { "$ref": "#/$defs/id" },
        "minIntervalSecs": { "type": "number", "exclusiveMinimum": 0 },
        "weaponMode": { "type": "string", "pattern": "^[a-z][a-z0-9_]{0,15}$" }
      },
      "allOf": [
        { "if": { "properties": { "group": { "const": "skill" } } }, "then": { "required": ["skill"] } },
        { "if": { "properties": { "group": { "const": "basic" } } }, "then": { "required": ["class", "minIntervalSecs"] } },
        { "if": { "properties": { "kind": { "const": "loop" } } }, "then": { "properties": { "loop": { "const": true } } } },
        { "if": { "properties": { "customizable": { "const": true } } },
          "then": { "properties": { "customizableFrom": { "type": "string" } } } }
      ]
    },
    "hero": {
      "type": "object",
      "additionalProperties": false,
      "required": ["id", "kind", "name", "role", "requirementId", "basicAttack", "kit", "handheld", "slots"],
      "properties": {
        "id": { "$ref": "#/$defs/id" },
        "kind": { "enum": ["class", "any"] },
        "name": { "type": "string", "minLength": 1, "maxLength": 64 },
        "role": { "type": ["string", "null"], "maxLength": 32 },
        "requirementId": { "type": "string", "maxLength": 128, "pattern": "^[a-z][a-z0-9-]*(\\.[a-z][a-z0-9-]*)*$" },
        "basicAttack": {
          "oneOf": [
            { "type": "null" },
            {
              "type": "object", "additionalProperties": false,
              "required": ["rangeM", "cooldownSecs", "attackRateCap", "minIntervalSecs", "slots"],
              "properties": {
                "rangeM": { "type": "number", "exclusiveMinimum": 0 },
                "cooldownSecs": { "type": "number", "exclusiveMinimum": 0 },
                "attackRateCap": { "type": "number", "minimum": 1 },
                "minIntervalSecs": { "type": "number", "exclusiveMinimum": 0 },
                "slots": { "type": "array", "minItems": 1, "items": { "$ref": "#/$defs/slotId" } }
              }
            }
          ]
        },
        "kit": {
          "type": "array", "maxItems": 4,
          "items": {
            "type": "object", "additionalProperties": false, "required": ["key", "skill", "name", "slots"],
            "properties": {
              "key": { "enum": ["q", "w", "e", "r"] },
              "skill": { "$ref": "#/$defs/id" },
              "name": { "type": "string", "minLength": 1, "maxLength": 64 },
              "slots": { "type": "array", "minItems": 1, "items": { "$ref": "#/$defs/slotId" } }
            }
          }
        },
        "handheld": {
          "oneOf": [
            { "type": "null" },
            {
              "type": "object", "additionalProperties": false, "required": ["default", "byMode", "bone"],
              "properties": {
                "default": { "type": "string" },
                "byMode": { "type": "object", "additionalProperties": { "type": "string" } },
                "bone": { "type": "string" }
              }
            }
          ]
        },
        "slots": { "type": "array", "minItems": 3, "uniqueItems": true, "items": { "$ref": "#/$defs/slotId" } }
      }
    }
  }
}
