{
 "schema": "omoba.character-contract.v1",
 "schemaVersion": 1,
 "projectId": "omoba",
 "revision": "sha256-b4029806322eac361e44458ba73e8570efbe016e7980a77b3f78c08517fc5f26",
 "previousRevision": null,
 "license": "CC0-1.0",
 "source": {
  "commit": "6d34f98",
  "exporter": "scripts/export_character_contract.py",
  "inputsSha256": "db0e37eec0499b593d08965e342ea0a69699ff7007af41a6f8e3eee05c300d03",
  "gameplayRevision": "standard-kits-8",
  "presentationSha256": "fe544cd0df722b9dd21753804c77091e3d8ddb64e863aebbfcfb3f0db4958ae4",
  "motionLibrary": {
   "schemaVersion": 1,
   "sha256": "2af1a6a0332bee5a840554efd7f4efdbf85941efe744c4b03df7fad382879a9a",
   "clips": 57
  },
  "protocolVersion": 11
 },
 "package": {
  "extrasKey": "ekza_animation_set_v1",
  "sourceFormats": [
   "vrm1",
   "vrm0"
  ],
  "rendition": {
   "platform": "desktop",
   "profile": "humanoid-glb-v2",
   "version": 1
  },
  "slotNaming": "animation-name-equals-slot-id",
  "customPlayback": {
   "rate": 1,
   "start": 0
  }
 },
 "rig": {
  "kind": "vrm-humanoid",
  "restPose": "t-pose",
  "facing": "as-vrm-spec",
  "requiredBones": [
   "hips",
   "spine",
   "head",
   "leftUpperArm",
   "leftLowerArm",
   "leftHand",
   "rightUpperArm",
   "rightLowerArm",
   "rightHand",
   "leftUpperLeg",
   "leftLowerLeg",
   "leftFoot",
   "rightUpperLeg",
   "rightLowerLeg",
   "rightFoot"
  ],
  "requiredBonesVrm0": [
   "chest",
   "neck"
  ],
  "drivenBones": [
   "chest",
   "head",
   "hips",
   "leftFoot",
   "leftHand",
   "leftIndexDistal",
   "leftIndexIntermediate",
   "leftIndexProximal",
   "leftLittleDistal",
   "leftLittleIntermediate",
   "leftLittleProximal",
   "leftLowerArm",
   "leftLowerLeg",
   "leftMiddleDistal",
   "leftMiddleIntermediate",
   "leftMiddleProximal",
   "leftRingDistal",
   "leftRingIntermediate",
   "leftRingProximal",
   "leftShoulder",
   "leftThumbDistal",
   "leftThumbIntermediate",
   "leftThumbProximal",
   "leftToes",
   "leftUpperArm",
   "leftUpperLeg",
   "neck",
   "rightFoot",
   "rightHand",
   "rightIndexDistal",
   "rightIndexIntermediate",
   "rightIndexProximal",
   "rightLittleDistal",
   "rightLittleIntermediate",
   "rightLittleProximal",
   "rightLowerArm",
   "rightLowerLeg",
   "rightMiddleDistal",
   "rightMiddleIntermediate",
   "rightMiddleProximal",
   "rightRingDistal",
   "rightRingIntermediate",
   "rightRingProximal",
   "rightShoulder",
   "rightThumbDistal",
   "rightThumbIntermediate",
   "rightThumbProximal",
   "rightToes",
   "rightUpperArm",
   "rightUpperLeg",
   "spine",
   "upperChest"
  ],
  "maxHumanoidBones": 64,
  "maxNodes": 4096,
  "uniformScale": "humanoid-bones-and-ancestors",
  "fingers": "optional",
  "thumbsRecommended": true,
  "legLengthFrom": "hips-to-feet",
  "referenceLegLengthM": 0.813
 },
 "timing": {
  "blendSecs": 0.12,
  "idleGraceSecs": 0.25,
  "facingHoldSecs": {
   "basic": 0.45,
   "skill": 0.7
  },
  "contactLimitSecs": 0.15,
  "rowRate": [
   0.5,
   2
  ],
  "rowStart": [
   0,
   0.8
  ],
  "fitRate": [
   0.5,
   2
  ],
  "unseenHoldSecs": 1.2,
  "freshSecs": 0.15,
  "maxGapSecs": 0.25,
  "deathCut": "immediate",
  "movementInterruptsAction": false,
  "newActionRestarts": true
 },
 "rules": [
  {
   "id": "pack.extras",
   "severity": "error",
   "scope": "pack",
   "params": {
    "key": "ekza_animation_set_v1",
    "schema": 1
   }
  },
  {
   "id": "pack.contract",
   "severity": "error",
   "scope": "pack",
   "params": {}
  },
  {
   "id": "pack.slot-known",
   "severity": "error",
   "scope": "pack",
   "params": {}
  },
  {
   "id": "pack.animation-ref",
   "severity": "error",
   "scope": "pack",
   "params": {
    "nameEqualsSlot": true
   }
  },
  {
   "id": "pack.unreferenced",
   "severity": "warning",
   "scope": "pack",
   "params": {}
  },
  {
   "id": "pack.bytes",
   "severity": "error",
   "scope": "pack",
   "params": {
    "maxFileBytes": 52428800,
    "maxJsonBytes": 4194304,
    "maxAnimationBytes": 4194304,
    "maxCustomSlots": 48
   }
  },
  {
   "id": "clip.channels",
   "severity": "error",
   "scope": "clip",
   "params": {
    "rotation": "humanoid-bones",
    "translation": [
     "hips"
    ],
    "scale": false,
    "weights": false
   }
  },
  {
   "id": "clip.sampler",
   "severity": "error",
   "scope": "clip",
   "params": {
    "interpolation": [
     "LINEAR",
     "STEP"
    ],
    "startsAtSecs": 0,
    "timeEpsilonSecs": 0.0001,
    "unitQuatEpsilon": 0.001
   }
  },
  {
   "id": "clip.keys",
   "severity": "error",
   "scope": "clip",
   "params": {
    "maxKeysPerChannel": 4096,
    "maxSampleRateHz": 60
   }
  },
  {
   "id": "clip.duration",
   "severity": "error",
   "scope": "clip",
   "params": {
    "source": "slot.window"
   }
  },
  {
   "id": "clip.in-place",
   "severity": "error",
   "scope": "clip",
   "params": {
    "unit": "legLength",
    "maxHorizontal": 0.15,
    "maxHorizontalHold": 0.75,
    "maxVertical": 0.6
   }
  },
  {
   "id": "clip.loop-closure",
   "severity": "error",
   "scope": "clip",
   "params": {
    "maxBoneDegrees": 2,
    "maxHipsOffset": 0.01,
    "unit": "legLength"
   }
  },
  {
   "id": "clip.contact",
   "severity": "error",
   "scope": "clip",
   "params": {
    "formula": "(contact - start * duration) / rate",
    "limitSecs": 0.15,
    "toleranceSecs": 0.0001
   }
  },
  {
   "id": "clip.basic-interval",
   "severity": "warning",
   "scope": "clip",
   "params": {
    "source": "slot.minIntervalSecs"
   }
  }
 ],
 "slots": {
  "base.death": {
   "group": "base",
   "role": "death",
   "label": "Death",
   "kind": "hold",
   "phase": "state",
   "edgeReleased": false,
   "customizable": true,
   "customizableFrom": "1",
   "reserved": false,
   "required": false,
   "default": {
    "motion": "death",
    "durationSecs": 2.375,
    "looping": false,
    "contactSecs": null,
    "rate": 1,
    "start": 0,
    "playSecs": 2.375,
    "effectiveContactSecs": null,
    "standInFor": null
   },
   "window": {
    "minSecs": 0.5,
    "targetSecs": 2.375,
    "maxSecs": 3
   },
   "inPlace": true,
   "loop": false,
   "contact": null,
   "telegraph": null,
   "handheld": null,
   "sharesDefaultWith": [],
   "alternatesWith": [],
   "usedBy": [
    "*"
   ]
  },
  "base.idle": {
   "group": "base",
   "role": "idle",
   "label": "Idle",
   "kind": "loop",
   "phase": "locomotion",
   "edgeReleased": false,
   "customizable": true,
   "customizableFrom": "1",
   "reserved": false,
   "required": false,
   "default": {
    "motion": "idle",
    "durationSecs": 2.5,
    "looping": true,
    "contactSecs": null,
    "rate": 1,
    "start": 0,
    "playSecs": 2.5,
    "effectiveContactSecs": null,
    "standInFor": null
   },
   "window": {
    "minSecs": 1,
    "targetSecs": 2.5,
    "maxSecs": 4
   },
   "inPlace": true,
   "loop": true,
   "contact": null,
   "telegraph": null,
   "handheld": null,
   "sharesDefaultWith": [],
   "alternatesWith": [],
   "usedBy": [
    "*"
   ]
  },
  "base.run": {
   "group": "base",
   "role": "run",
   "label": "Run (all movement)",
   "kind": "loop",
   "phase": "locomotion",
   "edgeReleased": false,
   "customizable": true,
   "customizableFrom": "1",
   "reserved": false,
   "required": false,
   "default": {
    "motion": "run",
    "durationSecs": 0.6667,
    "looping": true,
    "contactSecs": null,
    "rate": 1,
    "start": 0,
    "playSecs": 0.6667,
    "effectiveContactSecs": null,
    "standInFor": null
   },
   "window": {
    "minSecs": 0.4,
    "targetSecs": 0.6667,
    "maxSecs": 1.2
   },
   "inPlace": true,
   "loop": true,
   "contact": null,
   "telegraph": null,
   "handheld": null,
   "sharesDefaultWith": [],
   "alternatesWith": [],
   "usedBy": [
    "*"
   ]
  },
  "base.walk": {
   "group": "base",
   "role": "walk",
   "label": "Walk (reserved; not played yet)",
   "kind": "loop",
   "phase": "locomotion",
   "edgeReleased": false,
   "customizable": false,
   "customizableFrom": null,
   "reserved": true,
   "required": false,
   "default": {
    "motion": "walk",
    "durationSecs": 1.3333,
    "looping": true,
    "contactSecs": null,
    "rate": 1,
    "start": 0,
    "playSecs": 1.3333,
    "effectiveContactSecs": null,
    "standInFor": null
   },
   "window": {
    "minSecs": 0.8,
    "targetSecs": 1.3333,
    "maxSecs": 2
   },
   "inPlace": true,
   "loop": true,
   "contact": null,
   "telegraph": null,
   "handheld": null,
   "sharesDefaultWith": [],
   "alternatesWith": [],
   "usedBy": [
    "*"
   ]
  },
  "basic.adventurer.0": {
   "group": "basic",
   "role": "basic",
   "label": "Basic attack",
   "kind": "action",
   "phase": "instant",
   "edgeReleased": true,
   "customizable": true,
   "customizableFrom": "1",
   "reserved": false,
   "required": false,
   "default": {
    "motion": "dagger_stab",
    "durationSecs": 0.44,
    "looping": false,
    "contactSecs": 0.22,
    "rate": 1.6,
    "start": 0,
    "playSecs": 0.275,
    "effectiveContactSecs": 0.1375,
    "standInFor": null
   },
   "window": {
    "minSecs": 0.15,
    "targetSecs": 0.275,
    "maxSecs": 1.2
   },
   "inPlace": true,
   "loop": false,
   "contact": {
    "required": true,
    "maxSecs": 0.15,
    "targetSecs": 0.1375
   },
   "telegraph": null,
   "handheld": {
    "item": "dagger",
    "byMode": {},
    "bone": "rightHand",
    "muzzleWindowSecs": null
   },
   "sharesDefaultWith": [
    "skill.dagger_deadly_blow.release"
   ],
   "alternatesWith": [],
   "usedBy": [
    "adventurer"
   ],
   "class": "adventurer",
   "minIntervalSecs": 0.3889
  },
  "basic.chainkeeper.0": {
   "group": "basic",
   "role": "basic",
   "label": "Basic attack",
   "kind": "action",
   "phase": "instant",
   "edgeReleased": true,
   "customizable": true,
   "customizableFrom": "1",
   "reserved": false,
   "required": false,
   "default": {
    "motion": "toss_underhand",
    "durationSecs": 0.4,
    "looping": false,
    "contactSecs": 0.13,
    "rate": 0.9,
    "start": 0,
    "playSecs": 0.4444,